<?xml version="1.0" encoding="UTF-8"?>
<!--Sample XML file generated by XMLSpy v2008 rel. 2 sp2 (http://www.altova.com)-->
<SeamateItems xsi:noNamespaceSchemaLocation="items.xsd" xmlns:xsi="http://www.w3.org/2001/XMLSchema-instance">
	<Timeline>
		<ScheduledItem>
			<Time>10</Time>
			<ID>4</ID>
			<DM_ID>BAMS DM</DM_ID>
		</ScheduledItem>
		<ScheduledItem>
			<Time>70</Time>
			<ID>2</ID>
			<DM_ID>BAMS DM</DM_ID>
		</ScheduledItem>
		<ScheduledItem>
			<Time>130</Time>
			<ID>15</ID>
			<DM_ID>BAMS DM</DM_ID>
		</ScheduledItem>
		<ScheduledItem>
			<Time>190</Time>
			<ID>60</ID>
			<DM_ID>BAMS DM</DM_ID>
		</ScheduledItem>
		<ScheduledItem>
			<Time>250</Time>
			<ID>1</ID>
			<DM_ID>BAMS DM</DM_ID>
		</ScheduledItem>
		
	</Timeline>
	<Items>
		<Item>
			<ID>1</ID>
			<Parameters>
				<Crossing>false</Crossing>
				<Groupings>One</Groupings>
				<Threat>Unambiguous</Threat>
				<PlayerResources>Available</PlayerResources>
				<TeammateResources>Available</TeammateResources>
				<Difficulty>0.20</Difficulty>
			</Parameters>
			<Action>
				
			</Action>
		</Item>
		<Item>
			<ID>2</ID>
			<Parameters>
				<Crossing>false</Crossing>
				<Groupings>One</Groupings>
				<Threat>Ambiguous</Threat>
				<PlayerResources>Available</PlayerResources>
				<TeammateResources>Available</TeammateResources>
				<Difficulty>0.20</Difficulty>
			</Parameters>
			<Action>
				<Reveal>
					<ID>5069</ID>
					<Location>
						<AbsolutePosition>
							<X>125300</X>
							<Y>16600</Y>
							<Z>0</Z>
						</AbsolutePosition>
					</Location>
					<State>FullyFunctional</State>
					<TimeAfter>7</TimeAfter>
				</Reveal>
				<Reveal>
					<ID>9809</ID>
					<Location>
						<AbsolutePosition>
							<X>125400</X>
							<Y>27200</Y>
							<Z>0</Z>
						</AbsolutePosition>
					</Location>
					<State>FullyFunctional</State>
					<TimeAfter>2</TimeAfter>
				</Reveal>
				<Move>
					<ID>5069</ID>
					<Location>
						<AbsolutePosition>
							<X>86600</X>
							<Y>59200</Y>
							<Z>0</Z>
						</AbsolutePosition>
					</Location>
					<TimeAfter>8</TimeAfter>
				</Move>
				<Move>
					<ID>9809</ID>
					<Location>
						<AbsolutePosition>
							<X>87400</X>
							<Y>64000</Y>
							<Z>0</Z>
						</AbsolutePosition>
					</Location>
					<TimeAfter>8</TimeAfter>
				</Move>
			</Action>
		</Item>
		<Item>
			<ID>4</ID>
			<Parameters>
				<Crossing>false</Crossing>
				<Groupings>Two</Groupings>
				<Threat>Ambiguous</Threat>
				<PlayerResources>Available</PlayerResources>
				<TeammateResources>Available</TeammateResources>
				<Difficulty>0.20</Difficulty>
			</Parameters>
			<Action>
				<Reveal>
					<ID>6348</ID>
					<Location>
						<AbsolutePosition>
							<X>52000</X>
							<Y>12400</Y>
							<Z>0</Z>
						</AbsolutePosition>
					</Location>
					<State>FullyFunctional</State>
					<TimeAfter>5</TimeAfter>
				</Reveal>
				<Reveal>
					<ID>7151</ID>
					<Location>
						<AbsolutePosition>
							<X>84800</X>
							<Y>62300</Y>
							<Z>0</Z>
						</AbsolutePosition>
					</Location>
					<State>FullyFunctional</State>
					<TimeAfter>2</TimeAfter>
				</Reveal>
				<Move>
					<ID>6348</ID>
					<Location>
						<AbsolutePosition>
							<X>63600</X>
							<Y>72200</Y>
							<Z>0</Z>
						</AbsolutePosition>
					</Location>
					<TimeAfter>7</TimeAfter>
				</Move>
				<Move>
					<ID>7151</ID>
					<Location>
						<AbsolutePosition>
							<X>25200</X>
							<Y>98400</Y>
							<Z>0</Z>
						</AbsolutePosition>
					</Location>
					<TimeAfter>6</TimeAfter>
				</Move>
			</Action>
		</Item>
		<Item>
			<ID>12</ID>
			<Parameters>
				<Crossing>false</Crossing>
				<Groupings>Two</Groupings>
				<Threat>Ambiguous</Threat>
				<ThreatType>Non-imminent</ThreatType>
				<PlayerResources>Available</PlayerResources>
				<TeammateResources>Available</TeammateResources>
				<Difficulty>0.20</Difficulty>
			</Parameters>
			<Action>
				
			</Action>
		</Item>
		<Item>
			<ID>14</ID>
			<Parameters>
				<Crossing>true</Crossing>
				<Groupings>One</Groupings>
				<Threat>Ambiguous</Threat>
				<ThreatType>Non-imminent</ThreatType>
				<PlayerResources>Available</PlayerResources>
				<TeammateResources>Available</TeammateResources>
				<Difficulty>0.20</Difficulty>
			</Parameters>
			<Action>
				
			</Action>
		</Item>
		<Item>
			<ID>15</ID>
			<Parameters>
				<Crossing>true</Crossing>
				<Groupings>Two</Groupings>
				<Threat>Unambiguous</Threat>
				<ThreatType>Non-imminent</ThreatType>
				<PlayerResources>Available</PlayerResources>
				<TeammateResources>Available</TeammateResources>
				<Difficulty>0.20</Difficulty>
			</Parameters>
			<Action>
				
			</Action>
		</Item>
		<Item>
			<ID>41</ID>
			<Parameters>
				<Crossing>false</Crossing>
				<Groupings>One</Groupings>
				<Threat>Unambiguous</Threat>
				<ThreatType>Imminent</ThreatType>
				<PlayerResources>Available</PlayerResources>
				<TeammateResources>Available</TeammateResources>
				<Difficulty>.75</Difficulty>
			</Parameters>
			<Action>
			
			</Action>
		</Item>
		<Item>
			<ID>60</ID>
			<Parameters>
				<Crossing>false</Crossing>
				<Groupings>Two</Groupings>
				<Threat>Ambiguous</Threat>
				<ThreatType>Imminent</ThreatType>
				<PlayerResources>Unavailable</PlayerResources>
				<TeammateResources>Available</TeammateResources>
				<Difficulty>0.20</Difficulty>
			</Parameters>
			<Action>
				
			</Action>
		</Item>
	</Items>
</SeamateItems>
